{
  "slug": "2026-05-26-mcp-agent-tracing-standardization",
  "title": "MCP won the wiring layer — now the observability race begins",
  "dek": "The Model Context Protocol went from internal Anthropic experiment to cross-vendor standard in six months. The next battleground is tracing — who can make agent execution legible without slowing developers down.",
  "date": "2026-05-26",
  "dayOfWeek": "Tuesday",
  "readTimeMinutes": 7,
  "topic": "agent-frameworks-and-sdks",
  "tldr": "The most important infrastructure development of the past month is not a new model or a new framework. It is the Model Context Protocol becoming the default wiring layer between AI agents and external tools. Anthropic open-sourced MCP in late twenty twenty four and it crossed one thousand community-contributed servers by February of this year. That adoption rate is faster than the OAuth two point one standard or the OpenTelemetry tracing specification at the same stage of their lives. The race now is not about whether MCP becomes the plumbing. The race is about who builds the best observability layer on top of it. LangChain, LlamaIndex, and CrewAI all ship MCP-compatible builds. Anthropic's own Agent SDK and OpenAI's Agents SDK both treat MCP servers as first-class citizens. The result is that every major framework now speaks the same wire protocol, which means the next differentiator is tracing depth, not integration breadth. Agent traces are becoming the equivalent of distributed traces in microservices — the artifact that tells developers why an agent made the decision it did. For Clockchain, this is the moment to write the tracing layer that turns MCP's wire protocol into a timestamped, verifiable execution record.",
  "sections": [
    {
      "heading": "MCP crossed the one thousand server mark",
      "body": "Anthropic open-sourced the Model Context Protocol in November of twenty twenty four and by February of twenty twenty six the MCP community registry listed over one thousand server implementations. The categories that grew fastest were data-source connectors — vector databases, file systems, APIs, and enterprise data warehouses. That growth pattern tells you what developers want from MCP. They do not want it as a curiosity. They want it as the standardized pipe connecting a language model to every data source and tool an agent might need at runtime. The protocol reached one thousand servers faster than comparable infrastructure standards at similar stages of their lives. That adoption velocity solves a real coordination problem. Before MCP, every framework vendor had to write its own tool-calling integration for every external system. With MCP, one integration unlocks every framework that speaks the protocol. The wiring layer is now standardized, and the next question is what you build on top of it."
    },
    {
      "heading": "The observability race replaced the integration race",
      "body": "Between January and May of twenty twenty six, the language across LangChain, LlamaIndex, CrewAI, AutoGen, and every other active framework converged on a single next priority. Integration with MCP is now baseline. The winning move is observability. Every one of those frameworks now exposes a tracing or callback surface that developers can hook into to record what an agent did, which tools it called, which context it read, and what output it produced. LangChain ships LangSmith as its tracing layer. LlamaIndex ships its own observability module with OpenTelemetry compatibility. CrewAI added structured logging with trace IDs in April. The market signal is clear. Developers have solved the integration problem and are now solving the debugging problem. An agent that cannot explain why it made a decision is an agent that enterprise buyers will not trust in production. The trace is not a nice-to-have. It is the audit trail that makes agent deployments defensible to risk teams and compliance officers."
    },
    {
      "heading": "Two SDK philosophies are now in direct competition",
      "body": "Anthropic released its own Agent SDK in March of twenty twenty six and OpenAI released the Agents SDK in April. The two SDKs reflect two fundamentally different architectural bets about how agents should work. Anthropic's SDK treats the agent as a constrained, high-judgment system that should call tools rarely and deliberately. The design philosophy is conservative — agents should not act unless the cost of acting is clear. OpenAI's SDK treats the agent as a flexible, multi-step executor that should explore tool-calling paths aggressively and backtrack when needed. The design philosophy is permissive — agents should try things and correct course. Both SDKs support MCP as a first-class integration surface. Both are being evaluated by the same developer community right now, which means the observability and tracing story is the primary differentiator. Developers choosing between them are asking the same question: which SDK gives me the most legible execution record when something goes wrong. That question is an opening for Clockchain."
    },
    {
      "heading": "What this means for our agent products",
      "body": "Clockchain has two direct paths into the MCP observability moment. Product B, the Clockchain Agent-SDK, should ship MCP server support as its first integration surface. Every framework that speaks MCP becomes a potential customer the moment the SDK can act as a timestamped logging endpoint for MCP traces. The five-lines-to-first-log DX standard that the SDK is targeting maps directly onto what developers want from observability — drop in the SDK, point it at an MCP server, and get a cryptographically verifiable timestamp on every tool call and context read. Product A, the cryptographic birth certificate for agents, gains a new urgency when agents are operating inside MCP environments. An agent that has a verifiable birth certificate can prove its identity to every MCP server it connects to without re-authenticating per session. The traceable execution record that the observability layer produces is the execution history. A birth certificate tied to that trace is an attested execution provenance record. The combination of Product A identity and Product B SDK tracing against the MCP wire protocol is the highest-leverage near-term integration for Clockchain's agent product line."
    }
  ],
  "keyPoints": [
    "The Model Context Protocol crossed 1,000+ community-contributed servers by February 2026 — faster adoption than OAuth 2.1 or OpenTelemetry at comparable stages.",
    "LangChain, LlamaIndex, CrewAI, Anthropic Agent SDK, and OpenAI Agents SDK all treat MCP as a first-class integration surface — the wiring layer is now standardized.",
    "The competitive battleground shifted from integration breadth to observability depth: which SDK gives developers the most legible execution record when something goes wrong.",
    "Anthropic Agent SDK and OpenAI Agents SDK reflect two competing agent philosophies — conservative tool-calling versus permissive multi-step exploration.",
    "Clockchain Agent-SDK can position as the timestamped logging endpoint for MCP traces, turning the wire protocol into a verifiable execution record."
  ],
  "nextUp": [
    "Tell me more about how the Clockchain Agent-SDK should approach MCP server integration.",
    "Which observability surface should the SDK target first — LangSmith, LlamaIndex tracing, or OpenTelemetry.",
    "What does a birth certificate plus MCP trace prove that a trace alone does not."
  ],
  "sources": [
    { "title": "Model Context Protocol — Anthropic", "url": "https://www.anthropic.com/news/model-context-protocol" },
    { "title": "MCP Community Servers Registry", "url": "https://github.com/modelcontextprotocol/servers" },
    { "title": "LangChain Agent Framework", "url": "https://www.langchain.com/" },
    { "title": "LlamaIndex Agent Framework", "url": "https://www.llamaindex.ai/" },
    { "title": "Anthropic Agent SDK", "url": "https://docs.anthropic.com/en/docs/agent-sdk" },
    { "title": "OpenAI Agents SDK", "url": "https://platform.openai.com/docs/agents" },
    { "title": "CrewAI Agent Platform", "url": "https://www.crewai.com/" },
    { "title": "OpenTelemetry Agent Tracing Specification", "url": "https://opentelemetry.io/docs/specs/otel/trace/" }
  ]
}
